658ded6f-6d74-45f0-8516-241934a54d10,,St. Lawrence,Parish,Post Medieval 1540-1901 CE,Post Medieval 1540-1901 CE,"An incomplete pair of cast copper alloy dividers dated to the post medieval period (c.AD1600-1700).The object consists of two arms with a hinge in the shape of a knob at the terminal. The arms are trapezoidal in cross-section, both with three facets on their outer face. Each arm is broken, likely due to plough damage, though both would have curved outwards in the middle and would have formed a hollow circle. The terminal knob is cast as part of one arm and there is a narrow slot below this along one side where the other arm is secured.The object is in a good condition and has a mid-green patina.Similar shaped dividers are in the collection at the National Maritime Museum in Greenwich which are described as being used by mariners for measuring distances on charts and are dated to the mid 17th century. A similar example can be found on the UK PAS, number LVPL-98E99D.",,Incomplete,,,2cm,"Length: 85.08mm, Width at curve of arms: 32.62mm, Weight: 59.7g",01/05/2022,,,,,,,,Cultivated land,Cast,Copper alloy,Metric,Millimetres/grams,Dividers,Certain,,,,,600324,,Metal detector,,,,,,,,
517ecc2b-f9b6-4cae-a132-ae814442a50e,,St. Lawrence,Parish,Bronze Age 2600-701 BCE,Bronze Age 2600-701 BCE,"A flint barbed and tanged arrowhead of early Bronze Age date. The arrowhead has been invasively retouched over both faces. The tang is longer than the barbs, indicating a Sutton Type C arrowhead (Green 1980, p. 29). The surviving barb is obliquely cut, (Green type C). Type: Sutton Type C.Similar flint barb and tanged arrowheads are associated with the Beaker phase of the Late Neolithic and Early Bronze Age.Length: 29.02mm, Max width: 21.45mm, Thickness: 5.34mm, Tang length: 4.91mm, Barb length c.1.81mm, Weight: 3.0g.References:Green, H.S. (1980). The Flint Arrowheads of the British Isles. Oxford. BAR British Series 75.",,Incomplete,,,,"Length: 29.02mm, Max width: 21.45mm, Thickness: 5.34mm, Tang length: 4.91mm, Barb length c.1.81mm, Weight: 3.0g.",01/08/2022,,,,,,,,Cultivated land,Knapped/flaked,Flint,Metric,Millimetres/grams,Arrowhead,Certain,,,,,600325,,Chance find during metal detecting,,,,,,,,
1abe41fb-c400-4a84-af83-43e154da2444,,St. Lawrence,Parish,Modern 1901 CE-,Modern 1901 CE-,"A cast copper alloy modern miniature cap badge of The King's Royal Rifle Corps. The object is dated post-1902, the inscription giving a post- Second Boer War date. The King's Royal Rifle Corps were disbanded and the remainder amalgamated in 1966.	The badge is a Maltese Cross in form, with heavy gilding visible on both sides. The object is flat on the reverse. The top arm of the cross sits a crown decorated with red enamel. Beneath this is the inscription ""CELER ET AUDAX"" (Swift and Bold). Behind this inscription remains a green enamel. A central circle bears the image of a stringed bugle in relief, surrounded by the inscription ""THE KINGS ROYAL RIFLE CORPS"".  Behind this inscription remains a red enamel. The attachment The remaining inscription can be difficult to decipher, but looking at surviving non-miniature examples of this cap badge the following can be deciphered on each arm of the cross respectively:	Top		CELER ET AUDAX		Louisberg . Quebec 1769		Peninsula   Delhi		Roleia   Vimiera 		Martinique   Talavera		Busaco    Fuentes d' OnorLeft		Albuhera   Ciudad Rodrigo		Badajoz  Salamanca		Ahmed Khel  Kandahar		Vittoria  Pyrenees		Nivelle Nive		Orthes  ToulouseRight		Punjab		Mooltan Goojerat		South Africa 1851 . 2 . 3		Egypt 1882 1884		Tel .el .Kebir		Taku Forts  PekinBottom		Chitral		South Africa 1879		South Africa 1899  1902		Afghanistan 1878   80		Defence of Ladysmith		Relief of Ladysmith	It is noted that the smaller inscription cast on this example was unlikely to ever be readable due to its small size and casting quality, and was only meant to mimic the genuine medal.	This cap badge appears to be a miniature version, which could be bought by servicemen to wear and display in lieu of wearing their genuine badges and medals. ",,Incomplete,,,,"Length: 41.52, Width: 28.52, Thickness: 2.26, Weight: 6.0g.",01/02/2021,,,,,,,,Intertidal,Cast,Copper alloy,Metric,Millimetres/grams,Badge,Certain,,,,,600326,,Metal detector,Enamel,,,,,,,Gilded
8d7ba450-1e96-0138-8d72-740f24312a1c,,St. Peter,Parish,,,Granite muller Dimensions:  Length: 9.00 cm Width: 7.70 cm Thickness: 4.55 cm Part of the Kempster Collection.,,,,,,,,,,,,,,,,,Stone,Metric,Millimetres/grams,Muller,,,,,,1000312,,,,,,,,,,
9688028e-c679-4273-8c71-6ff6440f0e76,,St. Lawrence,Parish,Post Medieval 1540-1901 CE,Post Medieval 1540-1901 CE,"An incomplete cast copper alloy mount of probable Post-Medieval date (c. AD 1600-1800). The mount bears a moulded cancavo-convex anthropomorphic face of a cherub, putti or 'cupid' type. A single wing survives to the right of the face, with moulded feather-like decoration. The second wing has broken off near the head. The rear of the mount is mostly flat save for the convex area to the rear of the head, and also has a circular rivet, probably for attachment to a piece of furniture. Many similar objects with moulded cherub faces are very common, and are predominantly products of the Neoclassical Post-Medieval era, such as the following finds on the UK PAS: SWYOR-663556, LIN-9C93E2, WMID-875DDE.It is noted, however, that some similar moulded objects have been identified as Roman in date, such as PAS: SF8645, SF-8DBEE6 or SF-FAF633. Therefore, a Roman date cannot be ruled out entirely.",,Incomplete,,,6 inches,"Length: 41.62mm, Width: 27.02mm, Thickness: 5.82, Weight: 11.5g.",27/08/2022,,,,,,,,Cultivated land,Cast,Copper alloy,Metric,Millimetres/grams,Furniture fitting,Probable,,,,,600327,,Metal detector,,,,,,,,
102e1c3e-21fc-4a69-be3d-8c02471b6e13,,St. Lawrence,Parish,Neolithic 4000-2601 BCE,Neolithic 4000-2601 BCE,"An incomplete Neolithic polished serpentinite axehead. This is a large fragment of the axehead, with a curved butt at one end and an irregular diagonal break at the other end. The object flares outwards from the butt with mostly straight sides toward the break. One face of the object is irregularly convex, curving towards its sides. The face slopes upwards horizontally from the butt end at a roughly 30 degree angle before abruptly flattening out to run towards the broken end. The other face of the object is flat. Each side bears very prominent ridges that protrude out from the sides of the stone, with one side ridge being significantly more prominent than the other. The object is made of highly polished serpentinite, with clear grinding striations on each surface. The convex side is a dark blackish green at the butt, before becoming mottled with light green and brown streaks toward the break. The flat side of the object is a dark blackish green before a diagonal gradient towards lighter blueish-green, which continues as a gradient to a mid to light brown colour. The object appears to have been burnt. There are several instances of Alpine axeheads were deliberately burnt, broken, or both, as part of a ritual of deposition or ceremonial 'killing' of the object.Prof Pierre Pétrequin of University of Franche-Comte comments that the axe is a very particular type of serpentinite, probably that of the Gemsstock massif in Andermatt (Uri, Switzerland).Research is ongoing with this find through the JADE project with the help of Prof Alison Sheridan, who aim to analyse the axehead with a spectroradiometer. Further information will be added as research is undertaken.Bibliography:Pailler, Y. & Sheridan, A. (2012) ""Les haches alpines et leurs imitations en Grande- Bretagne, dans l'île de Man, en Irlande et dans les îles Anglo-Normandes"". JADE Grandes haches alpines du Néolithique européen. Ve et IVe millénaires av. J.-C., 2. 1046-1078.",,Incomplete,,,Unknown,"Length: 85.36mm, Width: 57.66mm, Thickness (at broken end): 25.24mm.",01/01/1977,,,,,,,,Cultivated land,Ground/polished,Stone,Metric,Millimetres/grams,Axehead,Certain,,,,,600328,,Other chance find,,,,,,,,
3158742c-2e5c-44e4-93ef-63513db98e7c,,St. Lawrence,Parish,Post Medieval 1540-1901 CE,Post Medieval 1540-1901 CE,"Cast copper-alloy smallsword guard, including with quillons and incomplete finger-guard of a Post-Medieval date, c. 1700-1800.Collaring at each end of the guard, with quillon and finger-guards obliquely set lozengiform socket at upper end. Corroded iron remains exist at each socket.",,Incomplete,,,Around 8 inches,"Length: 59.09mm, Width: 45.5mm, Thickness: 14.01mm, Weight: 52.8g",14/09/2022,,,,,,,,Cultivated land,Cast,Copper alloy,Metric,Millimetres/grams,Sword guard,Certain,,,,,600329,,Metal detector,Iron,,,,,,,
5225cc70-7a6f-0138-ef30-740f24312a1c,,St. Martin,Parish,Medieval 934-1539 CE,Post Medieval 1540-1901 CE,"A pottery sherd from a vessel which may have been a circular bowl or jug.  The base is complete and the sherd extends halfway up the spherical body. The broken edge reveals an inner grey layer and an outer pink layer which indicates a higher internal temperature and that the vessel may have had a neck, hence possibly being a jug.   One side of the sherd looks burnt suggesting that it stood close to a fire, possibly to warm wine or cider.  The manufacture origin is from the Seine Valley area in Picardy, Northern France. This is known as Beauvais and is famous for Medieval stoneware. This type of pottery was imported to Jersey over several centuries and examples of this type have been found at Hamptonne, St Lawrence during archaeological excavations and were dated between circa 1550 and circa 1600.  There is little evidence of the sherd being worn by the sea although it would have been in the sea for a long time. It is likely that the sherd was buried for most of the time after its deposition. ",,Fragment,,,Surface find (sea depth approx. 7m),Diameter: 200mm Base diameter: 117mm Thickness: 5mm Weight: 240g,01/07/2019,,,,,,,"http://jerseyv6-arches-media.s3.amazonaws.com/uploadedfiles/[{u'status': u'uploaded',http://jerseyv6-arches-media.s3.amazonaws.com/uploadedfiles/u'index': 0,http://jerseyv6-arches-media.s3.amazonaws.com/uploadedfiles/u'name': u'0700227.jpg',http://jerseyv6-arches-media.s3.amazonaws.com/uploadedfiles/0700227.jpg',http://jerseyv6-arches-media.s3.amazonaws.com/uploadedfiles/u'lastModified': 1579797602311,http://jerseyv6-arches-media.s3.amazonaws.com/uploadedfiles/u'height': 7087,http://jerseyv6-arches-media.s3.amazonaws.com/uploadedfiles/2902e16d-0365-4c6c-b4e7-3c262a130973',http://jerseyv6-arches-media.s3.amazonaws.com/uploadedfiles/u'width': 9449,http://jerseyv6-arches-media.s3.amazonaws.com/uploadedfiles/u'file_id': u'6b0ead56-9f51-11ea-8701-0275d4869ef4',http://jerseyv6-arches-media.s3.amazonaws.com/uploadedfiles/u'accepted': True,http://jerseyv6-arches-media.s3.amazonaws.com/uploadedfiles/jpeg',http://jerseyv6-arches-media.s3.amazonaws.com/uploadedfiles/u'size': 1583842}]",Intertidal,Hand made,Ceramic,Metric,Millimetres/grams,Vessel,Certain,,,,,700227,,Other chance find,,,,,,,,
5225db00-7a6f-0138-ef30-740f24312a1c,,St. Martin,Parish,Neolithic 4000-2601 BCE,Neolithic 4000-2601 BCE,A flint flake with some evidence of reworking.,,Complete,,,Surface,39mm x 18mm x 11mm 5.89g,01/10/2019,,,,,,,"http://jerseyv6-arches-media.s3.amazonaws.com/uploadedfiles/[{u'status': u'uploaded',http://jerseyv6-arches-media.s3.amazonaws.com/uploadedfiles/u'index': 0,http://jerseyv6-arches-media.s3.amazonaws.com/uploadedfiles/u'name': u'0700233.jpg',http://jerseyv6-arches-media.s3.amazonaws.com/uploadedfiles/0700233.jpg',http://jerseyv6-arches-media.s3.amazonaws.com/uploadedfiles/u'lastModified': 1580211970580,http://jerseyv6-arches-media.s3.amazonaws.com/uploadedfiles/u'height': 3832,http://jerseyv6-arches-media.s3.amazonaws.com/uploadedfiles/0095c2b8-391b-48c9-be4a-c01bacd7733a',http://jerseyv6-arches-media.s3.amazonaws.com/uploadedfiles/u'width': 4724,http://jerseyv6-arches-media.s3.amazonaws.com/uploadedfiles/u'file_id': u'307c12a0-9f51-11ea-8701-0275d4869ef4',http://jerseyv6-arches-media.s3.amazonaws.com/uploadedfiles/u'accepted': True,http://jerseyv6-arches-media.s3.amazonaws.com/uploadedfiles/jpeg',http://jerseyv6-arches-media.s3.amazonaws.com/uploadedfiles/u'size': 386283}]",Cultivated land,Knapped/flaked,Flint,Metric,Millimetres/grams,Flake,Certain,,,,,700233,,Chance find during metal detecting,,,,,,,,
7a59ec50-19c2-0138-c5b0-740f24312a1c,Field Number,St. Ouen,Parish,,,x5 flint flakes More flint objects were observed in the area but left in situ. Some had been brought to the surface by moles or rabbits. Only one flint flake was found on the fieldwalk 28.05.1980 as a specimen. It may be a scraper. The remaining x4 flakes were found at a later date. ,,,,,,,,,,,,,,,,,Flint,Metric,Millimetres/grams,Flake,,,,,,0900355,,Fieldwalking,,,,,,,,
5225ea50-7a6f-0138-ef30-740f24312a1c,,Grouville,Parish,Neolithic 4000-2601 BCE,Neolithic 4000-2601 BCE,Two flint flakes found on the beach. Both are water worn with possible retouching but neither are diagnostically tools. ,,Complete,,,Surface,1) 29.5mm x 17mm x 10mm 4.05g 2) 52.5mm x35mm x 22mm 36.66g ,01/10/2019,,,,,,,"http://jerseyv6-arches-media.s3.amazonaws.com/uploadedfiles/[{u'status': u'uploaded',http://jerseyv6-arches-media.s3.amazonaws.com/uploadedfiles/u'index': 0,http://jerseyv6-arches-media.s3.amazonaws.com/uploadedfiles/u'name': u'0700244.jpg',http://jerseyv6-arches-media.s3.amazonaws.com/uploadedfiles/0700244.jpg',http://jerseyv6-arches-media.s3.amazonaws.com/uploadedfiles/u'lastModified': 1581591038316,http://jerseyv6-arches-media.s3.amazonaws.com/uploadedfiles/u'height': 5906,http://jerseyv6-arches-media.s3.amazonaws.com/uploadedfiles/b7e766ea-1c97-4999-b03b-2774ab05d0fe',http://jerseyv6-arches-media.s3.amazonaws.com/uploadedfiles/u'width': 7087,http://jerseyv6-arches-media.s3.amazonaws.com/uploadedfiles/u'file_id': u'8529e92c-9f50-11ea-8701-0275d4869ef4',http://jerseyv6-arches-media.s3.amazonaws.com/uploadedfiles/u'accepted': True,http://jerseyv6-arches-media.s3.amazonaws.com/uploadedfiles/jpeg',http://jerseyv6-arches-media.s3.amazonaws.com/uploadedfiles/u'size': 772135}]",Intertidal,Knapped/flaked,Flint,Metric,Millimetres/grams,Flake,Certain,,,,,700244,,Chance find during metal detecting,,,,,,,,
817461e8-fc0d-11eb-8701-0275d4869ef4,,St. Martin,Parish,,,A heavily worn and damaged possible lead weight of unclear date.  The weight is sub-circular and has a drilled cylindrical hole running through its core approximately 5mm in diameter.  It is heavily plough-marked and split.,,Incomplete,,,8 inches,"Diameter: 67.34, thickness: 8.95g, weight: 183.5g",08/08/2020,,,,,,,"http://jerseyv6-arches-media.s3.amazonaws.com/uploadedfiles/[{u'status': u'uploaded',http://jerseyv6-arches-media.s3.amazonaws.com/uploadedfiles/u'index': 0,http://jerseyv6-arches-media.s3.amazonaws.com/uploadedfiles/u'name': u'0700330.jpg',http://jerseyv6-arches-media.s3.amazonaws.com/uploadedfiles/0700330.jpg',http://jerseyv6-arches-media.s3.amazonaws.com/uploadedfiles/u'lastModified': 1626191211821,http://jerseyv6-arches-media.s3.amazonaws.com/uploadedfiles/6bfe8641-11ad-4be5-9dcd-e0cd08a1e0a3',http://jerseyv6-arches-media.s3.amazonaws.com/uploadedfiles/u'file_id': u'92db7c00-fc0d-11eb-8701-0275d4869ef4',http://jerseyv6-arches-media.s3.amazonaws.com/uploadedfiles/u'accepted': True,http://jerseyv6-arches-media.s3.amazonaws.com/uploadedfiles/jpeg',http://jerseyv6-arches-media.s3.amazonaws.com/uploadedfiles/u'size': 4237753}]",Cultivated land,Cast,Lead,Metric,Millimetres/grams,Weight,Possibly,,,,,700330,,Metal detector,,,,,,,,
1aabd7a0-1e8b-0138-8d6b-740f24312a1c,,St. Martin,Parish,,,A retouched flint flake. ,,,,,,,,,,,,,,,,Knapped/flaked,Flint,Metric,Millimetres/grams,Flake,,,,,,700347,,,,,,,,,,
79daca80-19c2-0138-c5ac-740f24312a1c,,St. Martin,Parish,,,A flint flake of Grand Pressigny type. ,,,,,,3.21cm x 2.51cm x 0.85cm ,01/06/1978,,,,,,,,,Knapped/flaked,Flint,Metric,Millimetres/grams,Flake,,,,,,700348,,,,,,,,,,
0d11b1a0-1e7a-0138-8d61-740f24312a1c,,Grouville,Parish,,,"Oblong polished dolerite axe with blunt, bevelled end (No. 230) made of Porphyritic Ophitic Dolerite - petrology sample cut from it.  Dimensions:  Length: 10.05 cm  Width: 4.40 cm Thickness: 3.30 cm",,,,,,,,,,,,,,,,,Stone,Metric,Millimetres/grams,Axe,,,,,,0300366,,,,,,,,,,
1aabe9d0-1e8b-0138-8d6b-740f24312a1c,,St. Martin,Parish,,,A bronze socketed axe with loop. ,,,,,,13.24cm x 3.66cm x 2.78cm,,,,,,,,,,Cast,Copper alloy,Metric,Millimetres/grams,Axehead,,,,,,700349,,,,,,,,,,
75d5f3de-42e8-11ec-8701-0275d4869ef4,Field Number,Trinity,Parish,Gallo-Roman 51 BCE-451 CE,Gallo-Roman 51 BCE-451 CE,"Société Jersiaise Finds Record Entry SJFR159 (2018) reads: Fragment of the flat base and slightly thicker shallow-sloped side of a Gallo-Roman whiteware plate or shallow dish, recycled as a crucible for melting copper-alloy.  Fabric is a fine and creamy white earthenware, similar to 1st-2nd century AD dish sherds from St Clement Churchyard.  In places it is slightly cracked with green copper oxide staining.  Metal crusting its interior is bright green, shading to dull green and black in places, suggestive of the presence of lead.  Its surface is blobby and undulates considerably. See also SJFR160 – a virtually identical crucible fragment from Grouville. Three tin ingot fragments and two pieces of a Roman tin alloy statuette of 2nd-3rd century AD date have been found in fields to the east and north-east, suggesting that this was a Gallo-Roman metal processing site.",,Fragment,,,,"Dimensions: 51mm x 39mm x 13mm thick (of which 4.2mm-6mm is crucible wall and 3mm-9mm is crusted copper alloy), Weight:43.50g",2018-06-01,,,,,,,,Cultivated land,,Ceramic,Metric,Millimetres/grams,Crucible,Certain,Trinity,,Trinity,,1200346,,Metal detector,,,,,,,,
1aac0000-1e8b-0138-8d6b-740f24312a1c,,St. Martin,Parish,Neolithic 4000-2601 BCE,Neolithic 4000-2601 BCE,"Neolithic polished stone axehead. 

Round edged triangular axe with bevelled end made of dolerite type A. ",,,,,,12.95cm x 4.85cm x 2.60cm,,,,,,,,,,Ground/polished,Stone,Metric,Millimetres/grams,Axehead,,,,,,700353,,,,,,,,,,
79daea00-19c2-0138-c5ac-740f24312a1c,,St. Martin,Parish,,Mesolithic 10000-4001 BCE,"x39 flint blades, possibly Upper Palaeolithic/Mesolithic.",,,,,,,,,,,,,,,,Knapped/flaked,Flint,Metric,Millimetres/grams,Blade,,,,,,700357,,,,,,,,,,
79db0330-19c2-0138-c5ac-740f24312a1c,,St. Martin,Parish,Neolithic 4000-2601 BCE,Neolithic 4000-2601 BCE,"Three axes:  a) Polished Flint Axe - unusued (13.6cm x 5.5cm x 1.3cm x 1.9cm) b) Fibrolite Axe - some wear or post-deposition (5.6cm x 3.7cm x 1.2cm x 1.6cm)  c) Broken Button Axe - possibly local diorite, blade missing but button well preserved. (12.4cm x 3.2cm, width of blade 5.2cm)",,,,,,See description.,,,,,,,,,,,Stone,Metric,Millimetres/grams,Axehead,,,,,,700361,,,,,,,,,,
79db4b30-19c2-0138-c5ac-740f24312a1c,,St. Martin,Parish,Mesolithic 10000-4001 BCE,Mesolithic 10000-4001 BCE,A Mesolithic to Bronze Age flint scraper. ,,,,,,1.65cm x 1.87cm x 0.50cm,30/09/1983,,,,,,,,Cultivated land,Knapped/flaked,Flint,Metric,Millimetres/grams,Scraper (tool),,,,,,700370,,Fieldwalking,,,,,,,,
d39ad82c-fc16-11eb-8701-0275d4869ef4,,St. Martin,Parish,Medieval 934-1539 CE,Medieval 934-1539 CE,"Cast copper alloy seal matrix of the 13th to 14th century.  This seal matrix is vesica shaped (oval with pointed ends), 32.69mm long, 20.59mm wide, 3.00mm thick and 6.4g in weight. These seals were used mainly by women, ecclesiastical figures or secular clergy. The obverse of the seal is flat, with a depiction split into an upper and lower register. The upper register depicts ""The Shrine of the Nursing Madonna"" the Virgin Mary nursing Jesus beneath an arch, flanked by two towers with pointed finials. The lower register bears a praying prior or abbot beneath a winged dome, probably meant to represent a  pitched church roof.  The reverse of the matrix, behind the upper pointed end, are the remains of a lug (3.01mm in width, and would have been c 7.01mm in length).  The legend surrounding the device reads: +AVE.MARIA.GRA.PLENA.DMS.TEC €œAve Maria Gratia Plena Dominus Tecum€  This is the ""Hail Mary"", a traditional Catholic prayer in Latin. As this anonymous inscription does not name an individual, it may have been a ready-made seal distributed to various lesser church dignitaries.   Harvey & McGuinness (1996) illustrate a similar seal matrix  dated c.1292: ""Seals of lesser church dignitaries followed a pattern similar to bishops' seals though smaller in size. Thus they are usually a pointed oval, by the late thirteenth century showing a saint - here the Virgin and Child - with suppliant figure below"" (ibid, 74).  Ref: Harvey, P.D.A. & McGuiness, A. (1996) A Guide to British Medieval Seals. Toronto: University of Toronto Press.  Thanks to Ioan McCarthy for his transcript of the inscription.",,Incomplete,,,,"Weight: 6.4g, Length: 32.96, Width: 20.59, Thickness 3.00mm.",,,,,,,,"http://jerseyv6-arches-media.s3.amazonaws.com/uploadedfiles/[{u'status': u'uploaded',http://jerseyv6-arches-media.s3.amazonaws.com/uploadedfiles/u'index': 0,http://jerseyv6-arches-media.s3.amazonaws.com/uploadedfiles/u'name': u'0700377 seal.jpg',http://jerseyv6-arches-media.s3.amazonaws.com/uploadedfiles/0700377_seal.jpg',http://jerseyv6-arches-media.s3.amazonaws.com/uploadedfiles/u'lastModified': 1627396769843,http://jerseyv6-arches-media.s3.amazonaws.com/uploadedfiles/91c5f047-29b3-4c3a-ab28-f71673e1e97e',http://jerseyv6-arches-media.s3.amazonaws.com/uploadedfiles/u'file_id': u'e2bdcb0c-fc16-11eb-8701-0275d4869ef4',http://jerseyv6-arches-media.s3.amazonaws.com/uploadedfiles/u'accepted': True,http://jerseyv6-arches-media.s3.amazonaws.com/uploadedfiles/jpeg',http://jerseyv6-arches-media.s3.amazonaws.com/uploadedfiles/u'size': 5275425}]",Cultivated land,Cast,Copper alloy,Metric,Millimetres/grams,Seal matrix,Certain,,,,,700377,,Metal detector,,,,,,,,
