a9f46db1-2a92-4459-b042-2e796ba3712e,,Grouville,Parish,Post Medieval 1540-1901 CE,Post Medieval 1540-1901 CE,"A copper-alloy 16th century single faced coin weight of the Post-Medieval period. The decorated face shows a cross potent motif within a quadriolobe and milled circle of pellets.Coin weights bearing a cross motif were generally used to weigh Spanish or Portuguese coins, or coins produced from their colonies. However, it falls a little under the standard weights for both the Spanish escudo (3.38g) and the Portugese cruzado (3.5g), though this may be explained due to erosion.",,Complete,,,,"Length: 13.78mm, Width: 13.62mm, Thickness: 2.41mm, Weight: 2.8g",01/01/2014,,,,,,,,Cultivated land,Cast,Copper alloy,Metric,Millimetres/grams,Coin weight,Certain,,,,,300106,,Metal detector,,,,,,,,Stamped
52258580-7a6f-0138-ef30-740f24312a1c,,Grouville,Parish,Neolithic 4000-2601 BCE,Neolithic 4000-2601 BCE,A stage 3 flake knapped probably from a flint nodule. It has potentially at least one useful (non-cortex) edge but otherwise there is no more evidence of the flake being reworked for use as a tool. ,,Complete,,,Within 1ft. ,30mm x 28mm x 9mm 3.8g,26/08/2019,,,,,,,"http://jerseyv6-arches-media.s3.amazonaws.com/uploadedfiles/[{u'status': u'uploaded',http://jerseyv6-arches-media.s3.amazonaws.com/uploadedfiles/u'index': 0,http://jerseyv6-arches-media.s3.amazonaws.com/uploadedfiles/u'name': u'0300216.jpg',http://jerseyv6-arches-media.s3.amazonaws.com/uploadedfiles/0300216.jpg',http://jerseyv6-arches-media.s3.amazonaws.com/uploadedfiles/u'lastModified': 1590669743763,http://jerseyv6-arches-media.s3.amazonaws.com/uploadedfiles/a7f73ab2-d164-478a-93c3-72cbbad448dc',http://jerseyv6-arches-media.s3.amazonaws.com/uploadedfiles/u'file_id': u'ec0520e4-a0e0-11ea-8701-0275d4869ef4',http://jerseyv6-arches-media.s3.amazonaws.com/uploadedfiles/u'accepted': True,http://jerseyv6-arches-media.s3.amazonaws.com/uploadedfiles/jpeg',http://jerseyv6-arches-media.s3.amazonaws.com/uploadedfiles/u'size': 919402}]",Cultivated land,Knapped/flaked,Flint,Metric,Millimetres/grams,Flake,Certain,,,,,300216,,Chance find during metal detecting,,,,,,,,
33c17a70-193b-0138-c588-740f24312a1c,,St. Helier,Parish,,,A flint scraper and a polished bone fragment were found in the Grands Vaux area. They may not have been found at the same site or at the same time.  The scraper measures to 3.7cm x 3.3cm x 1.5cm.  The bone fragment measures to 7.2cm x 2.1cm x 0.5cm.,,,,,,Scraper: 3.7cm x 3.3cm x 1.5cm Bone: 7.2cm x 2.1cm x 0.5cm,,,,,,,,,,,Flint,Metric,Millimetres/grams,Flint implement,,,,,,0400816,,,,,,,,,,
52259040-7a6f-0138-ef30-740f24312a1c,,Grouville,Parish,Neolithic 4000-2601 BCE,Neolithic 4000-2601 BCE,A re-worked flint flake with some cortex remaining. ,,Complete,,,Surface,31mm x 19mm x 4mm 1.89g,01/10/2019,,,,,,,"http://jerseyv6-arches-media.s3.amazonaws.com/uploadedfiles/[{u'status': u'uploaded',http://jerseyv6-arches-media.s3.amazonaws.com/uploadedfiles/u'index': 0,http://jerseyv6-arches-media.s3.amazonaws.com/uploadedfiles/u'name': u'0300217.jpg',http://jerseyv6-arches-media.s3.amazonaws.com/uploadedfiles/0300217_1ZEoTiL.jpg',http://jerseyv6-arches-media.s3.amazonaws.com/uploadedfiles/u'lastModified': 1580229299230,http://jerseyv6-arches-media.s3.amazonaws.com/uploadedfiles/u'height': 3248,http://jerseyv6-arches-media.s3.amazonaws.com/uploadedfiles/63767086-3757-45f4-b9a4-b29a7ba8cb6b',http://jerseyv6-arches-media.s3.amazonaws.com/uploadedfiles/u'width': 3366,http://jerseyv6-arches-media.s3.amazonaws.com/uploadedfiles/u'file_id': u'414cd27c-9f51-11ea-8701-0275d4869ef4',http://jerseyv6-arches-media.s3.amazonaws.com/uploadedfiles/u'accepted': True,http://jerseyv6-arches-media.s3.amazonaws.com/uploadedfiles/jpeg',http://jerseyv6-arches-media.s3.amazonaws.com/uploadedfiles/u'size': 260300}]",Cultivated land,Knapped/flaked,Flint,Metric,Millimetres/grams,Flake,Certain,,,,,300217,,Chance find during metal detecting,,,,,,,,
3c5c5bce-f6ae-11eb-8701-0275d4869ef4,,Grouville,Parish,Post Medieval 1540-1901 CE,Post Medieval 1540-1901 CE,Fragments of copper sheathing have been uncovered by several metal detectorists since 2018. These fragments may have originated from the HMS Severn which became damaged in Grouville Bay in December 1804. The crew were rescued from the ship and the cargo unloaded once the ship was brought closer to shore by spring tides. Some of the fragments are dated '1794' which is thought to have been part of a refit at Plymouth Dockyard for the 1786 ship. Another fragment has a handle. ,,,,,,,,,,,,,,,,Cast,Copper alloy,,,Sheathing,Possibly,,,,,300218,,,,,,,,,,
0d1192d0-1e7a-0138-8d61-740f24312a1c,,Grouville,Parish,,,Left half of an unidentified animal skull.  Dimensions:  Length: 11.7 ? Width: 8.9 ? Thickness: 5.4 ?  *? could be cm,,,,,,,,,,,,,,,,,Animal skeletal material,Metric,Millimetres/grams,Animal bone,,,,,,0300362,,,,,,,,,,
52259bf0-7a6f-0138-ef30-740f24312a1c,,Grouville,Parish,Neolithic 4000-2601 BCE,Neolithic 4000-2601 BCE,A honey coloured flint flake. ,,Complete,,,Half a foot,20mm x 19mm x 8mm 2.38g,01/08/2019,,,,,,,"http://jerseyv6-arches-media.s3.amazonaws.com/uploadedfiles/[{u'status': u'uploaded',http://jerseyv6-arches-media.s3.amazonaws.com/uploadedfiles/u'index': 0,http://jerseyv6-arches-media.s3.amazonaws.com/uploadedfiles/u'name': u'0300219.jpg',http://jerseyv6-arches-media.s3.amazonaws.com/uploadedfiles/0300219.jpg',http://jerseyv6-arches-media.s3.amazonaws.com/uploadedfiles/u'lastModified': 1581521354942,http://jerseyv6-arches-media.s3.amazonaws.com/uploadedfiles/0df38d02-25f7-401b-afca-374ef2e1c026',http://jerseyv6-arches-media.s3.amazonaws.com/uploadedfiles/u'file_id': u'a37d8f32-9f50-11ea-8701-0275d4869ef4',http://jerseyv6-arches-media.s3.amazonaws.com/uploadedfiles/u'accepted': True,http://jerseyv6-arches-media.s3.amazonaws.com/uploadedfiles/jpeg',http://jerseyv6-arches-media.s3.amazonaws.com/uploadedfiles/u'size': 432747}]",Cultivated land,Knapped/flaked,Stone,Metric,Millimetres/grams,Flake,Certain,,,,,300219,,Chance find during metal detecting,,,,,,,,
5225a890-7a6f-0138-ef30-740f24312a1c,,Grouville,Parish,Palaeolithic 500000-10001 BCE,Palaeolithic 500000-10001 BCE,A flint implement which may be a core fragment. The fragment is sea worn and the patina suggests that it is of Palaeolithic date. ,,Fragment,,,Surface,68mm x 39mm x 29mm  62.8g,01/01/2018,,,,,,,"http://jerseyv6-arches-media.s3.amazonaws.com/uploadedfiles/[{u'status': u'uploaded',http://jerseyv6-arches-media.s3.amazonaws.com/uploadedfiles/u'index': 0,http://jerseyv6-arches-media.s3.amazonaws.com/uploadedfiles/u'name': u'0300258.jpg',http://jerseyv6-arches-media.s3.amazonaws.com/uploadedfiles/0300258.jpg',http://jerseyv6-arches-media.s3.amazonaws.com/uploadedfiles/u'lastModified': 1581942330635,http://jerseyv6-arches-media.s3.amazonaws.com/uploadedfiles/u'height': 4724,http://jerseyv6-arches-media.s3.amazonaws.com/uploadedfiles/371c231e-329c-4460-90cf-be76e133d2cd',http://jerseyv6-arches-media.s3.amazonaws.com/uploadedfiles/u'width': 3872,http://jerseyv6-arches-media.s3.amazonaws.com/uploadedfiles/u'file_id': u'6eaedd88-9f50-11ea-8701-0275d4869ef4',http://jerseyv6-arches-media.s3.amazonaws.com/uploadedfiles/u'accepted': True,http://jerseyv6-arches-media.s3.amazonaws.com/uploadedfiles/jpeg',http://jerseyv6-arches-media.s3.amazonaws.com/uploadedfiles/u'size': 441894}]",Intertidal,Knapped/flaked,Stone,Metric,Millimetres/grams,Core,Possibly,,,,,300258,,Other chance find,,,,,,,,
4a0692c0-194c-0138-c58e-740f24312a1c,,Grouville,Parish,Palaeolithic 500000-10001 BCE,Bronze Age 2600-701 BCE,Flint flake discovered on a track near fields G488 and G489. Dimensions:  Length: 3.41 cm  Width: 2.52 cm  Thickness: 1.25 cm ,,,,,,"Length: 3.41 cm 
Width: 2.52 cm 
Thickness: 1.25 cm ",06/08/2019,,,,,,,,Cultivated land,Knapped/flaked,Flint,Metric,Millimetres/grams,Flake,,,,,,300323,,Fieldwalking,,,,,,,,
4a06a070-194c-0138-c58e-740f24312a1c,,Grouville,Parish,,,Worked flint nodule found by chance. ,,,,,,14.96cm  x 7.13cm x 5.14cm,11/04/1980,,,,,,,,,Knapped/flaked,Flint,Metric,Millimetres/grams,Lithic implement,,,,,,300326,,Other chance find,,,,,,,,
4a06b130-194c-0138-c58e-740f24312a1c,,Grouville,Parish,Medieval 934-1539 CE,Medieval 934-1539 CE,Two 14th century French costrels (vessels).,,,,,,,,,,,,,,,Cultivated land,Wheel made,Ceramic,Metric,Millimetres/grams,Vessel,,,,,,300328,,,,,,,,,,
4a06d940-194c-0138-c58e-740f24312a1c,,Grouville,Parish,Neolithic 4000-2601 BCE,Neolithic 4000-2601 BCE,"Large local diorite axe, very finely polished. 

Chance find during building work. 

Found during building work by DH Sutherland, building contractor. Mark Patton visited the site on 24/06/1993. No features or material noted. The material was loesic colluvium.",,,,,,,22/06/1993,,,,,,,,,Ground/polished,Stone,Metric,Millimetres/grams,Axehead,,,,,,300335,,Other chance find,,,,,,,,
ed3f7cda-fea8-11eb-8701-0275d4869ef4,Offshore Islet,St. Helier,Parish,Gallo-Roman 51 BCE-451 CE,Post Medieval 1540-1901 CE,"A complete cast lead throwing die of unknown date (AD 43-1800).  The die is cuboid in shape, with six sides. The die is crudely cast and the sides are unequal. The holes have been drilled in a non-conventional manner and the sides have not been organised in the standard 'seven' system, where the total of the holes on opposing sides add up to seven. 1 is opposite 4, 2 is opposite 5, 3 is opposite 6.  The die is light brown, white and grey in colour. Abrasion, possibly caused by rocks or the sea, has rendered the faces difficult to read.  Dice are frequently found and can be of any date from the Roman period through to the Post Medieval period (AD 43 to AD 1700). It has been suggested that apart from their usual role in games of chance, the clergy may have occasionally used them as they could identify 56 different virtues, one for each of the outcomes created by throwing three dice together, and therefore to help them choose between different courses of action (Egan, 1997, 1).  Egan, G. 1997. Dice. Finds Research Group datasheet 23. Finds Research Group.",,Complete,Untreated,,Under rocks,"Length: 12.8mm, Width: 11.9mm, Corner to corner: 18.61",2021-02-01,,,,,,,"http://jerseyv6-arches-media.s3.amazonaws.com/uploadedfiles/[{u'status': u'uploaded',http://jerseyv6-arches-media.s3.amazonaws.com/uploadedfiles/ u'index': 0,http://jerseyv6-arches-media.s3.amazonaws.com/uploadedfiles/ u'name': u'0401484 .jpg',http://jerseyv6-arches-media.s3.amazonaws.com/uploadedfiles/0401484_.jpg',http://jerseyv6-arches-media.s3.amazonaws.com/uploadedfiles/ u'lastModified': 1628239495925,http://jerseyv6-arches-media.s3.amazonaws.com/uploadedfiles/bc19b9bc-fd94-4836-bc7a-8c3bff77a162',http://jerseyv6-arches-media.s3.amazonaws.com/uploadedfiles/ u'file_id': u'fb0cadce-fea8-11eb-8701-0275d4869ef4',http://jerseyv6-arches-media.s3.amazonaws.com/uploadedfiles/ u'accepted': True,http://jerseyv6-arches-media.s3.amazonaws.com/uploadedfiles/jpeg',http://jerseyv6-arches-media.s3.amazonaws.com/uploadedfiles/ u'size': 2642759}]",SSI,Cast,Lead,Metric,Millimetres/grams,Die,Certain,Elizabeth Castle,,Elizabeth Castle,,0401484,,Other chance find,,,,,,,Returned to Finder,Incised or engraved or chased
4a06e180-194c-0138-c58e-740f24312a1c,,Grouville,Parish,,,Coriosolite billon stater - Rybot Class II ,,,,,,,01/08/1992,,,,,,,,,Struck or hammered,Copper alloy,Metric,Millimetres/grams,Coin,,,,,,300336,,Metal detector,,,,,,,,
4a06e9c0-194c-0138-c58e-740f24312a1c,,Grouville,Parish,,,Bronze bracelet decorated with cast ridges arranged in groups of three. ,,,,,,,01/08/1992,,,,,,,,,Cast,Copper alloy,Metric,Millimetres/grams,Bracelet,,,,,,300337,,Metal detector,,,,,,,,
4a06fb80-194c-0138-c58e-740f24312a1c,,Grouville,Parish,,,Amorican billon stater. Very poor condition - unidentifiable. ,,,,,,,01/08/1992,,,,,,,,,Struck or hammered,Copper alloy,Metric,Millimetres/grams,Coin,,,,,,300339,,Metal detector,,,,,,,,
0d1199f0-1e7a-0138-8d61-740f24312a1c,,Grouville,Parish,Neolithic 4000-2601 BCE,Neolithic 4000-2601 BCE,Jadeite axe made in the Alps.  Sinel Cat. No. 18a  British Museum No. 70.,,,,,,,,,,,,,,,,Ground/polished,Stone,Metric,Millimetres/grams,Axehead,,,,,,300363,,,,,,,,,,
c6f02fa2-2bef-11eb-8701-0275d4869ef4,,Grouville,Parish,Unknown,Unknown,A small hollow piece of bronze which may be a pot leg. There is a small hole which is almost on the crease of the leg where it would have attached to the rest of the vessel. The flat surface's dimensions are 9mm x 9mm x 1mm. The body of the pot leg measures 18mm x 7mm x 5mm. It weighs 2.2g. Although the date is unknown it could range between the Bronze Age and Medieval periods. ,,Fragment,,,8 inches,Length: 18mm Width: 7mm Depth: 5mm Weight: 2.2g ,01/02/2020,,,,,,,"http://jerseyv6-arches-media.s3.amazonaws.com/uploadedfiles/[{u'status': u'uploaded',http://jerseyv6-arches-media.s3.amazonaws.com/uploadedfiles/u'index': 0,http://jerseyv6-arches-media.s3.amazonaws.com/uploadedfiles/u'name': u'0300374.jpg',http://jerseyv6-arches-media.s3.amazonaws.com/uploadedfiles/0300374.jpg',http://jerseyv6-arches-media.s3.amazonaws.com/uploadedfiles/u'lastModified': 1597749251809,http://jerseyv6-arches-media.s3.amazonaws.com/uploadedfiles/u'height': 4134,http://jerseyv6-arches-media.s3.amazonaws.com/uploadedfiles/1f7e47fc-9a87-42c3-9356-fe3f6278fc08',http://jerseyv6-arches-media.s3.amazonaws.com/uploadedfiles/u'width': 7087,http://jerseyv6-arches-media.s3.amazonaws.com/uploadedfiles/u'file_id': u'd77a362e-2bef-11eb-8701-0275d4869ef4',http://jerseyv6-arches-media.s3.amazonaws.com/uploadedfiles/u'accepted': True,http://jerseyv6-arches-media.s3.amazonaws.com/uploadedfiles/jpeg',http://jerseyv6-arches-media.s3.amazonaws.com/uploadedfiles/u'size': 552541}]",Cultivated land,Hand made,Copper alloy,Metric,Millimetres/grams,Vessel,Possibly,,,,,300374,,Metal detector,,,,,,,,
48ff775a-2bf0-11eb-8701-0275d4869ef4,,Grouville,Parish,Unknown,Unknown,"An angular fragment of bronze which may have been a part of a vessel. There is a somewhat large black stain on one side. The dimension's of this object are 50mm in length at the longest and 43mm in length at the shortest. Also, it is 43mm in width at the widest part and 4mm in width at the thinnest point. It ranges in thickness in a gradual increase from 1mm to 4mm. It weighs 27.5g. Although the date is unknown it could range between the Bronze Age and Medieval periods. ",,Fragment,,,8 inches,,01/02/2020,,,,,,,"http://jerseyv6-arches-media.s3.amazonaws.com/uploadedfiles/[{u'status': u'uploaded',http://jerseyv6-arches-media.s3.amazonaws.com/uploadedfiles/u'index': 0,http://jerseyv6-arches-media.s3.amazonaws.com/uploadedfiles/u'name': u'0300375.jpg',http://jerseyv6-arches-media.s3.amazonaws.com/uploadedfiles/0300375.jpg',http://jerseyv6-arches-media.s3.amazonaws.com/uploadedfiles/u'lastModified': 1597749540806,http://jerseyv6-arches-media.s3.amazonaws.com/uploadedfiles/88e56d0f-31f6-4fa6-97b0-58266f406314',http://jerseyv6-arches-media.s3.amazonaws.com/uploadedfiles/u'file_id': u'511e0988-2bf0-11eb-8701-0275d4869ef4',http://jerseyv6-arches-media.s3.amazonaws.com/uploadedfiles/u'accepted': True,http://jerseyv6-arches-media.s3.amazonaws.com/uploadedfiles/jpeg',http://jerseyv6-arches-media.s3.amazonaws.com/uploadedfiles/u'size': 1043180}]",Cultivated land,Cast,Copper alloy,,,Vessel,Possibly,,,,,300375,,Metal detector,,,,,,,,
a40b9610-1377-11eb-8701-0275d4869ef4,,Grouville,Parish,Bronze Age 2600-701 BCE,Bronze Age 2600-701 BCE,"A fragment of a copper alloy blade from a Bronze Age sword or knife. The object is rectangular in plan with a flat sub-rectangular cross section. The cutting edges have been extensively broken and abraded. Also, the metal is pitted with a green/brown corroded patina.   The height of the fragment is 53.5mm, the thickness is 7.8mm the width is 30.0mm and it weighs 37.52g.",,Fragment,,,6 inches,53.5 x 30.0 x 7.8mm 37.52g,01/03/2020,,,,,,,"http://jerseyv6-arches-media.s3.amazonaws.com/uploadedfiles/[{u'status': u'uploaded',http://jerseyv6-arches-media.s3.amazonaws.com/uploadedfiles/u'index': 0,http://jerseyv6-arches-media.s3.amazonaws.com/uploadedfiles/u'name': u'0300377.jpg',http://jerseyv6-arches-media.s3.amazonaws.com/uploadedfiles/0300377.jpg',http://jerseyv6-arches-media.s3.amazonaws.com/uploadedfiles/u'lastModified': 1601046441423,http://jerseyv6-arches-media.s3.amazonaws.com/uploadedfiles/u'height': 5906,http://jerseyv6-arches-media.s3.amazonaws.com/uploadedfiles/b5fd5d2f-344e-4219-a917-392cf82f637a',http://jerseyv6-arches-media.s3.amazonaws.com/uploadedfiles/u'width': 6000,http://jerseyv6-arches-media.s3.amazonaws.com/uploadedfiles/u'file_id': u'b0ea754a-1377-11eb-8701-0275d4869ef4',http://jerseyv6-arches-media.s3.amazonaws.com/uploadedfiles/u'accepted': True,http://jerseyv6-arches-media.s3.amazonaws.com/uploadedfiles/jpeg',http://jerseyv6-arches-media.s3.amazonaws.com/uploadedfiles/u'size': 918422}]",Cultivated land,Cast,Copper alloy,Metric,Millimetres/grams,Blade,Certain,,,,,300377,,Metal detector,,,,,,,,
1f20d0d6-1378-11eb-8701-0275d4869ef4,,Grouville,Parish,Medieval 934-1539 CE,Post Medieval 1540-1901 CE,"A small lead alloy decorated object which may be a mount with the stud missing. It could date between the 15th and 17th centuries. It is deeply embossed with a rose head one one side and has a flat back. Comparative objects can be seen in Identifying Metal Artefacts Volume One, numbers 261 and 342.   The dimensions are 29.5mm x 22.0mm x 4.0mm and weighs 11.22g. ",,,,,6 inches,29.5 x 22.0 x 4.0mm 11.22g,01/03/2020,,,,,,,"http://jerseyv6-arches-media.s3.amazonaws.com/uploadedfiles/[{u'status': u'uploaded',http://jerseyv6-arches-media.s3.amazonaws.com/uploadedfiles/u'index': 0,http://jerseyv6-arches-media.s3.amazonaws.com/uploadedfiles/u'name': u'0300378.jpg',http://jerseyv6-arches-media.s3.amazonaws.com/uploadedfiles/0300378.jpg',http://jerseyv6-arches-media.s3.amazonaws.com/uploadedfiles/u'lastModified': 1601047251309,http://jerseyv6-arches-media.s3.amazonaws.com/uploadedfiles/u'height': 3543,http://jerseyv6-arches-media.s3.amazonaws.com/uploadedfiles/c61f22ef-1229-445d-90a6-d8b4f7478a1a',http://jerseyv6-arches-media.s3.amazonaws.com/uploadedfiles/u'width': 6008,http://jerseyv6-arches-media.s3.amazonaws.com/uploadedfiles/u'file_id': u'ec020eec-137a-11eb-8701-0275d4869ef4',http://jerseyv6-arches-media.s3.amazonaws.com/uploadedfiles/u'accepted': True,http://jerseyv6-arches-media.s3.amazonaws.com/uploadedfiles/jpeg',http://jerseyv6-arches-media.s3.amazonaws.com/uploadedfiles/u'size': 556035}]",Cultivated land,Cast,Lead,Metric,Millimetres/grams,Mount,Possibly,,,,,300378,,Metal detector,,,,,,,,
e07f8916-07c0-11eb-8701-0275d4869ef4,,Grouville,Parish,Post Medieval 1540-1901 CE,Post Medieval 1540-1901 CE,"A silver/copper alloy ornate quillon or cross guard for an edged weapon. The motifs at the terminals could represent a wolf or dog head. The central decoration on the quillon has a curved linear design. It has a green/brown patina but recent scratches reveal bright silver. In another damaged area there is trace remains of gilding. Also, there is iron corrosion covering areas on the surface of the centre, top, bottom and one side presumably corrosion from the iron tang or blade which is clear in the centre where there is a dense amount of iron corrosion.   The quillon is likely to have been from a side-arm probably a hunting weapon or perhaps a dagger. The former being a consideration due to the wolf/dog head motifs at the terminals. Also, it may have belonged to a hunting hanger which although a larger weapon could often bear a comparatively small quillon. The date could be circa 17th/18th century due to the scroll form decoration however it could be earlier, circa 15th/16th century due its size.   It's dimensions are 60.0mm x 20.0mm x 10.01mm and weighs 32.37g. ",,Incomplete,,,1/5 foot,63.0mm x 20.0 x 10.1mm 32.37g,01/11/2019,,,,,,,"http://jerseyv6-arches-media.s3.amazonaws.com/uploadedfiles/[{u'status': u'uploaded',http://jerseyv6-arches-media.s3.amazonaws.com/uploadedfiles/u'index': 0,http://jerseyv6-arches-media.s3.amazonaws.com/uploadedfiles/u'name': u'0300379.jpg',http://jerseyv6-arches-media.s3.amazonaws.com/uploadedfiles/0300379.jpg',http://jerseyv6-arches-media.s3.amazonaws.com/uploadedfiles/u'lastModified': 1601044357868,http://jerseyv6-arches-media.s3.amazonaws.com/uploadedfiles/52b0e136-0f05-457d-8d62-c1a06fb40c8a',http://jerseyv6-arches-media.s3.amazonaws.com/uploadedfiles/u'file_id': u'0592e2e8-07c1-11eb-8701-0275d4869ef4',http://jerseyv6-arches-media.s3.amazonaws.com/uploadedfiles/u'accepted': True,http://jerseyv6-arches-media.s3.amazonaws.com/uploadedfiles/jpeg',http://jerseyv6-arches-media.s3.amazonaws.com/uploadedfiles/u'size': 1148615}]",Cultivated land,Cast,Copper alloy,Metric,Millimetres/grams,Dagger,Certain,,,,,300379,,Metal detector,Silver,,,,,,,Gilded
6d6d84ea-42fd-11ec-8701-0275d4869ef4,Field Number,St. Saviour,Parish,Bronze Age 2600-701 BCE,Bronze Age 2600-701 BCE,"Société Jersiaise Finds Record Entry 167 (2018) reads:  Three fragments, possibly of the same narrow-bladed sword (or epee), found close to each other, 200m north of La Hougue Bie.  All three fragments have blades of lozenge section, with very slightly concave faces.  The two larger fragments have the same pale green surface patina, while the smaller fragment appears to have a break matching the median piece, suggesting that all three came from the same weapon.  The largest piece (167a) has two sets of seven finely engraved lines, running parallel to each other down both adjoining faces on either side of the blade, converging to a point on the central rib 29mm down the blade from its upper end.  Each of these lines is about 003mm wide and about 0.7mm apart, forming bands 4.6mm wide, which are very slightly convex over their length.  The larger pieces both have gas bubbles in their broken faces; these are plough-battered, with pale green bronze disease, so were broken in antiquity.  Dirks or short swords of Treboul type (named after the place in Brittany where weapons with this type of decoration were first identified), with the handle being riveted to the blade just above its unusually broad head, were manufactured in Armorica (present-day Brittany and Western Normandy) between c.1500-1200 BC.  A hilt fragment of a dirk or short sword with similar decoration to 167a (SJFR166) was found in Field T945, but Middle Bronze Age artefacts are uncommon in Jersey and these are the only finds of engraved Treboul type swords known from the island.",,Fragment,,,,"Dimensions:167a: 41.7mm x 24.5mm x 6.1mm 167b: 43mm x 23mm-19.6mm (tapers) x 6mm 167c: 25mm x 17mm-15.6mm (tapers) x 5mm When laid out with gaps allowing for the taper, they come to c.115mm long. Weight:167a: 26.01g; 167b: 23.17g; 167c: 7.78g",2018-01-25,,,,,,,,Cultivated land,Cast,Copper alloy,Metric,Millimetres/grams,Sword blade,Certain,St. Saviour,,St. Saviour,,0700391,,Metal detector,,,,,,,,
